<?xml version="1.0" encoding="UTF-8"?>

<Disney xmlns:xsi= "http://www.w3.org/2001/XMLSchema-instance"
   xsi:noNamespaceSchemaLocation="Disney.xsd">

  <Actors>
    <Actor id="RobertDowneyJr">
      <Name>Robert Downey Jr.</Name>
      <BirthDay>1965-04-04</BirthDay>
      <BirthPlace>Manhattan, New York City, New York, USA</BirthPlace>
    </Actor>
  </Actors>

  <Subsidiaries>

    <Subsidiary id="MarvelStudios">
      <Movie>
        <Name lang="en">Iron Man</Name>
        <Year>2008</Year>
        <ScreenTime unit="minutes">126</ScreenTime>
        <Cast>
          <Role alias="Iron Man" actor="RobertDowneyJr" />
        </Cast>
      </Movie>
    </Subsidiary>

  </Subsidiaries>

</Disney>
